Name,Location,Address,PRICE RANGE,CUISINES,SPECIAL DIETS,Meals,FEATURES,Link,Southern-Italian,Japanese Fusion,Korean,Indonesian,Middle Eastern,Central-Italian,Diner,Steakhouse,Pizza,Southwestern,Wine Bar,Cajun & Creole,Bar,Latin,Seafood,Scottish,Mexican,Singaporean,Central European,Spanish,Deli,Cafe,Barbecue,Gastropub,Italian,Mongolian,Vietnamese,Thai,International,French,Contemporary,Polynesian,German,Afghani,Street Food,Lebanese,Australian,Cuban,Pub,Soups,Fusion,Moroccan,Caribbean,Dining bars,Sushi,Sri Lankan,Portuguese,Malaysian,Asian,British,Mediterranean,Turkish,Healthy,Indian,Irish,Pakistani,Arabic,Sicilian,Japanese,African,Fast Food,Beer restaurants,Fujian,Chinese,European,American,Grill,Dog Friendly,Gift Cards Available,Serves Alcohol,Digital Payments,Accepts Credit Cards,Buffet,Accepts Mastercard,BYOB,Live Music,Family style,Table Service,Takeout,Wheelchair Accessible,Wine and Beer,Full Bar,Accepts Discover,Cash Only,Free off-street parking,Valet Parking,Private Dining,Delivery,Accepts Visa,Television,Highchairs Available,Validated Parking,Reservations,Jazz Bar,Non-smoking restaurants,Free Wifi,Accepts American Express,Street Parking,Beach,Parking Available,Outdoor Seating,Waterfront,Seating,Halal,Vegetarian Friendly,Kosher,Nonveg,Vegan Options,Gluten Free Options,Drinks,Late Night,Lunch,Breakfast,Brunch,Dinner,Budget,Low,Medium,High,cluster
Plus Nine Four,"35 D S Fonseka Road, Colombo 00500 Sri Lanka","D S Fonseka Road, Colombo 00500 ","[' 200 ', '  1,500']","Cafe, Fusion","Vegetarian Friendly, Vegan Options, Gluten Free Options","Breakfast, Lunch, Brunch","Takeout, Outdoor Seating, Seating, Table Service, Reservations",https://www.tripadvisor.com/Restaurant_Review-g293962-d14148973-Reviews-Plus_Nine_Four-Colombo_Western_Province.html,0,0,0,0,0,0,0,0,0,0,0,0,0,0,0,0,0,0,0,0,0,1,0,0,0,0,0,0,0,0,0,0,0,0,0,0,0,0,0,0,1,0,0,0,0,0,0,0,0,0,0,0,0,0,0,0,0,0,0,0,0,0,0,0,0,0,0,0,0,0,0,0,0,0,0,0,0,1,1,0,0,0,0,0,0,0,0,0,0,0,0,0,1,0,0,0,0,0,0,0,1,0,1,0,1,0,0,1,1,0,0,1,1,1,0,Low,1,0,0,2
Ramen Misoya Colombo,"Reid Avenue Race Course Promenade, Colombo 00000 Sri Lanka","Reid Avenue Race Course Promenade, Colombo 00000 ","[' 989 ', '  3,956']","Japanese, Asian","Vegetarian Friendly, Vegan Options","Lunch, Dinner","Takeout, Reservations, Parking Available, Free off-street parking, Accepts Credit Cards, Table Service, Seating",https://www.tripadvisor.com/Restaurant_Review-g293962-d13400791-Reviews-Ramen_Misoya_Colombo-Colombo_Western_Province.html,0,0,0,0,0,0,0,0,0,0,0,0,0,0,0,0,0,0,0,0,0,0,0,0,0,0,0,0,0,0,0,0,0,0,0,0,0,0,0,0,0,0,0,0,0,0,0,0,1,0,0,0,0,0,0,0,0,0,1,0,0,0,0,0,0,0,0,0,0,0,0,1,0,0,0,0,0,1,1,0,0,0,0,0,1,0,0,0,0,0,0,0,1,0,0,0,0,0,0,1,0,0,1,0,1,0,0,1,0,0,0,1,0,0,1,Low,1,0,0,2
A Minute by Tuk Tuk Colombo,"No 9 Level 06, Sunset Terrace, One Galle Face, Colombo, Colombo 00100 Sri Lanka","unset Terrace, One Galle Face, Colombo, Colombo 00100 ","[' 200 ', '  2,000']","Bar, Asian, Sri Lankan, Contemporary, Fusion","Vegetarian Friendly, Vegan Options","Lunch, Dinner, Brunch, Late Night, Drinks","Reservations, Seating, Table Service, Serves Alcohol",https://www.tripadvisor.com/Restaurant_Review-g293962-d19436070-Reviews-A_Minute_by_Tuk_Tuk_Colombo-Colombo_Western_Province.html,0,0,0,0,0,0,0,0,0,0,0,0,1,0,0,0,0,0,0,0,0,0,0,0,0,0,0,0,0,0,1,0,0,0,0,0,0,0,0,0,1,0,0,0,0,1,0,0,1,0,0,0,0,0,0,0,0,0,0,0,0,0,0,0,0,0,0,0,0,1,0,0,0,0,0,0,0,1,0,0,0,0,0,0,0,0,0,0,0,0,0,0,1,0,0,0,0,0,0,0,0,0,1,0,1,0,0,1,0,1,1,1,0,1,1,Low,1,0,0,2
Momo's by Ruvi,"664 Galle Main Road, Colombo 00300 Sri Lanka","Galle Main Road, Colombo 00300 ","[' 310 ', '  1,250']","Chinese, Asian","Vegetarian Friendly, Vegan Options","Lunch, Dinner","Takeout, Seating, Wheelchair Accessible, Delivery, Table Service",https://www.tripadvisor.com/Restaurant_Review-g293962-d12332905-Reviews-Momo_s_by_Ruvi-Colombo_Western_Province.html,0,0,0,0,0,0,0,0,0,0,0,0,0,0,0,0,0,0,0,0,0,0,0,0,0,0,0,0,0,0,0,0,0,0,0,0,0,0,0,0,0,0,0,0,0,0,0,0,1,0,0,0,0,0,0,0,0,0,0,0,0,0,0,1,0,0,0,0,0,0,0,0,0,0,0,0,0,1,1,1,0,0,0,0,0,0,0,1,0,0,0,0,0,0,0,0,0,0,0,0,0,0,1,0,1,0,0,1,0,0,0,1,0,0,1,Low,1,0,0,2
Culinary Ceylon,"Hospital Street, Colombo Sri Lanka","Hospital Street, Colombo ","[' 14,837 ', '  19,782']","Sri Lankan, Asian","Vegetarian Friendly, Vegan Options, Gluten Free Options","Dinner, Breakfast, Lunch","Reservations, Table Service",https://www.tripadvisor.com/Restaurant_Review-g293962-d16648228-Reviews-Culinary_Ceylon-Colombo_Western_Province.html,0,0,0,0,0,0,0,0,0,0,0,0,0,0,0,0,0,0,0,0,0,0,0,0,0,0,0,0,0,0,0,0,0,0,0,0,0,0,0,0,0,0,0,0,0,1,0,0,1,0,0,0,0,0,0,0,0,0,0,0,0,0,0,0,0,0,0,0,0,0,0,0,0,0,0,0,0,1,0,0,0,0,0,0,0,0,0,0,0,0,0,0,1,0,0,0,0,0,0,0,0,0,0,0,1,0,0,1,1,0,0,1,1,0,1,Medium,0,1,0,2
The t-Lounge by Dilmah,"Shop #04, Arcade Independence Square, Colombo Sri Lanka","Arcade Independence Square, Colombo ","[' 1000 ', '  30 000']",Cafe,Vegetarian Friendly,"Breakfast, Lunch, Brunch","Takeout, Reservations, Seating, Free Wifi, Table Service",https://www.tripadvisor.com/Restaurant_Review-g293962-d7374797-Reviews-The_t_Lounge_by_Dilmah-Colombo_Western_Province.html,0,0,0,0,0,0,0,0,0,0,0,0,0,0,0,0,0,0,0,0,0,1,0,0,0,0,0,0,0,0,0,0,0,0,0,0,0,0,0,0,0,0,0,0,0,0,0,0,0,0,0,0,0,0,0,0,0,0,0,0,0,0,0,0,0,0,0,0,0,0,0,0,0,0,0,0,0,1,1,0,0,0,0,0,0,0,0,0,0,0,0,0,1,0,0,1,0,0,0,0,0,0,1,0,1,0,0,0,0,0,0,1,1,1,0,Medium,0,1,0,2
Robata Grill and Lounge,"No. 24 Dharmapala Mawatha Movenpick Hotel Colombo, Colombo 00300 Sri Lanka","Dharmapala Mawatha Movenpick Hotel Colombo, Colombo 00300","[' 1,600 ', '  3,000']","Japanese, Seafood, Sushi, Asian, Chinese, Thai, Korean","Vegetarian Friendly, Vegan Options, Gluten Free Options","Dinner, Lunch","Reservations, Seating, Table Service, Serves Alcohol",https://www.tripadvisor.com/Restaurant_Review-g293962-d12933494-Reviews-Robata_Grill_and_Lounge-Colombo_Western_Province.html,0,0,1,0,0,0,0,0,0,0,0,0,0,0,1,0,0,0,0,0,0,0,0,0,0,0,0,1,0,0,0,0,0,0,0,0,0,0,0,0,0,0,0,0,1,0,0,0,1,0,0,0,0,0,0,0,0,0,1,0,0,0,0,1,0,0,0,0,0,1,0,0,0,0,0,0,0,1,0,0,0,0,0,0,0,0,0,0,0,0,0,0,1,0,0,0,0,0,0,0,0,0,1,0,1,0,0,1,1,0,0,1,0,0,1,Low,1,0,0,2
New Banana Leaf,"720 Galle Road, Colombo 00300 Sri Lanka","Galle Road, Colombo 00300","[' 1000 ', '  20 000']","Indian, Asian, Sri Lankan","Vegetarian Friendly, Vegan Options, Halal","Lunch, Dinner","Takeout, Seating, Table Service",https://www.tripadvisor.com/Restaurant_Review-g293962-d7353046-Reviews-New_Banana_Leaf-Colombo_Western_Province.html,0,0,0,0,0,0,0,0,0,0,0,0,0,0,0,0,0,0,0,0,0,0,0,0,0,0,0,0,0,0,0,0,0,0,0,0,0,0,0,0,0,0,0,0,0,1,0,0,1,0,0,0,0,1,0,0,0,0,0,0,0,0,0,0,0,0,0,0,0,0,0,0,0,0,0,0,0,1,1,0,0,0,0,0,0,0,0,0,0,0,0,0,0,0,0,0,0,0,0,0,0,0,1,1,1,0,0,1,0,0,0,1,0,0,1,Medium,0,1,0,2
The Cafe on the 5th,"5th Lane, Colombo Sri Lanka","5th Lane, Colombo ","[' 396 ', '  1,187']","Asian, Sri Lankan","Vegetarian Friendly, Vegan Options","Breakfast, Lunch, Dinner, Late Night","Takeout, Reservations, Outdoor Seating, Seating, Wheelchair Accessible, Table Service",https://www.tripadvisor.com/Restaurant_Review-g293962-d811875-Reviews-The_Cafe_on_the_5th-Colombo_Western_Province.html,0,0,0,0,0,0,0,0,0,0,0,0,0,0,0,0,0,0,0,0,0,0,0,0,0,0,0,0,0,0,0,0,0,0,0,0,0,0,0,0,0,0,0,0,0,1,0,0,1,0,0,0,0,0,0,0,0,0,0,0,0,0,0,0,0,0,0,0,0,0,0,0,0,0,0,0,0,1,1,1,0,0,0,0,0,0,0,0,0,0,0,0,1,0,0,0,0,0,0,0,1,0,1,0,1,0,0,1,0,0,1,1,1,0,1,Low,1,0,0,2
The t-Lounge on Chatham Street by Dilmah,"62/2 Chatham Street Dutch Square, Block B, Colombo 01000 Sri Lanka","Chatham Street Dutch Square, Block B, Colombo 01000","[' 989 ', '  1,978']",Cafe,Vegetarian Friendly,"Breakfast, Lunch, Brunch","Seating, Free Wifi, Table Service",https://www.tripadvisor.com/Restaurant_Review-g293962-d4789689-Reviews-The_t_Lounge_on_Chatham_Street_by_Dilmah-Colombo_Western_Province.html,0,0,0,0,0,0,0,0,0,0,0,0,0,0,0,0,0,0,0,0,0,1,0,0,0,0,0,0,0,0,0,0,0,0,0,0,0,0,0,0,0,0,0,0,0,0,0,0,0,0,0,0,0,0,0,0,0,0,0,0,0,0,0,0,0,0,0,0,0,0,0,0,0,0,0,0,0,1,0,0,0,0,0,0,0,0,0,0,0,0,0,0,0,0,0,1,0,0,0,0,0,0,1,0,1,0,0,0,0,0,0,1,1,1,0,Low,1,0,0,2
Life Food,"31 Perehara Mawatha Corner of Alwis Place, Colombo 00300 Sri Lanka","Perehara Mawatha Corner of Alwis Place, Colombo 00300 ","[' 791 ', '  1,978']","Fusion, Healthy, Cafe","Vegetarian Friendly, Vegan Options, Gluten Free Options","Takeout, Seating, Table Service","Takeout, Seating, Table Service",https://www.tripadvisor.com/Restaurant_Review-g293962-d12243319-Reviews-Life_Food-Colombo_Western_Province.html,0,0,0,0,0,0,0,0,0,0,0,0,0,0,0,0,0,0,0,0,0,1,0,0,0,0,0,0,0,0,0,0,0,0,0,0,0,0,0,0,1,0,0,0,0,0,0,0,0,0,0,0,1,0,0,0,0,0,0,0,0,0,0,0,0,0,0,0,0,0,0,0,0,0,0,0,0,1,1,0,0,0,0,0,0,0,0,0,0,0,0,0,0,0,0,0,0,0,0,0,0,0,1,0,1,0,0,1,1,0,0,0,0,0,0,Low,1,0,0,2
Pho Vietnam,"71 Rosemead Place, Colombo 01000 Sri Lanka","Rosemead Place, Colombo 01000 ","[' 396 ', '  989']","Asian, Vietnamese, Soups","Vegetarian Friendly, Vegan Options","Lunch, Dinner","Takeout, Reservations, Seating, Cash Only, Free Wifi, Wheelchair Accessible, Table Service, Parking Available",https://www.tripadvisor.com/Restaurant_Review-g293962-d7804538-Reviews-Pho_Vietnam-Colombo_Western_Province.html,0,0,0,0,0,0,0,0,0,0,0,0,0,0,0,0,0,0,0,0,0,0,0,0,0,0,1,0,0,0,0,0,0,0,0,0,0,0,0,1,0,0,0,0,0,0,0,0,1,0,0,0,0,0,0,0,0,0,0,0,0,0,0,0,0,0,0,0,0,0,0,0,0,0,0,0,0,1,1,1,0,0,0,1,0,0,0,0,0,0,0,0,1,0,0,1,0,0,0,1,0,0,1,0,1,0,0,1,0,0,0,1,0,0,1,Low,1,0,0,2
Geek HQ,"17A Frankfort Place, Colombo 00400 Sri Lanka","Frankfort Place, Colombo 00400 ","[' 500 ', '  1,000']","Chinese, Japanese, American, Sri Lankan",Vegetarian Friendly,"Lunch, Dinner","Takeout, Seating, Table Service",https://www.tripadvisor.com/Restaurant_Review-g293962-d15335724-Reviews-Geek_HQ-Colombo_Western_Province.html,0,0,0,0,0,0,0,0,0,0,0,0,0,0,0,0,0,0,0,0,0,0,0,0,0,0,0,0,0,0,0,0,0,0,0,0,0,0,0,0,0,0,0,0,0,1,0,0,0,0,0,0,0,0,0,0,0,0,1,0,0,0,0,1,0,1,0,0,0,0,0,0,0,0,0,0,0,1,1,0,0,0,0,0,0,0,0,0,0,0,0,0,0,0,0,0,0,0,0,0,0,0,1,0,1,0,0,0,0,0,0,1,0,0,1,Low,1,0,0,2
Sri Suryas,"255, Sea Street, Colombo 11, Colombo Sri Lanka","Sea Street, Colombo 11, Colombo","[' 1000 ', '  20 000']","Indian, Asian","Vegetarian Friendly, Vegan Options, Gluten Free Options","Breakfast, Lunch, Dinner","Takeout, Reservations, Seating, Table Service",https://www.tripadvisor.com/Restaurant_Review-g293962-d6367079-Reviews-Sri_Suryas-Colombo_Western_Province.html,0,0,0,0,0,0,0,0,0,0,0,0,0,0,0,0,0,0,0,0,0,0,0,0,0,0,0,0,0,0,0,0,0,0,0,0,0,0,0,0,0,0,0,0,0,0,0,0,1,0,0,0,0,1,0,0,0,0,0,0,0,0,0,0,0,0,0,0,0,0,0,0,0,0,0,0,0,1,1,0,0,0,0,0,0,0,0,0,0,0,0,0,1,0,0,0,0,0,0,0,0,0,1,0,1,0,0,1,1,0,0,1,1,0,1,Medium,0,1,0,2
Curry Pot,"314/1a Kollupitiya Road Marine Drive, Colombo 00300 Sri Lanka"," Kollupitiya Road Marine Drive, Colombo 00300","[' 1000 ', '  20 000']","Asian, Sri Lankan","Vegetarian Friendly, Vegan Options",Lunch,"Seating, Takeout",https://www.tripadvisor.com/Restaurant_Review-g293962-d9765787-Reviews-Curry_Pot-Colombo_Western_Province.html,0,0,0,0,0,0,0,0,0,0,0,0,0,0,0,0,0,0,0,0,0,0,0,0,0,0,0,0,0,0,0,0,0,0,0,0,0,0,0,0,0,0,0,0,0,1,0,0,1,0,0,0,0,0,0,0,0,0,0,0,0,0,0,0,0,0,0,0,0,0,0,0,0,0,0,0,0,0,1,0,0,0,0,0,0,0,0,0,0,0,0,0,0,0,0,0,0,0,0,0,0,0,1,0,1,0,0,1,0,0,0,1,0,0,0,Medium,0,1,0,2
Dwaraka,"37, Jayashree Road Marine Drive, Colombo Sri Lanka","Jayashree Road Marine Drive, Colombo ","[' 600 ', '  10 000']","Indian, Asian","Vegetarian Friendly, Vegan Options","Lunch, Dinner, Brunch, Breakfast","Takeout, Seating, Table Service, Reservations",https://www.tripadvisor.com/Restaurant_Review-g293962-d9717623-Reviews-Dwaraka-Colombo_Western_Province.html,0,0,0,0,0,0,0,0,0,0,0,0,0,0,0,0,0,0,0,0,0,0,0,0,0,0,0,0,0,0,0,0,0,0,0,0,0,0,0,0,0,0,0,0,0,0,0,0,1,0,0,0,0,1,0,0,0,0,0,0,0,0,0,0,0,0,0,0,0,0,0,0,0,0,0,0,0,1,1,0,0,0,0,0,0,0,0,0,0,0,0,0,1,0,0,0,0,0,0,0,0,0,1,0,1,0,0,1,0,0,0,1,1,1,1,Medium,0,1,0,2
The Lagoon,"77 Galle Road Cinnamon Grand Colombo, Colombo Sri Lanka","Cinnamon Grand Colombo, Colombo ","[' 500 ', '  20 000']","Seafood, Spanish, Scottish, Sri Lankan, Asian",Vegetarian Friendly,"Lunch, Dinner","Reservations, Seating, Serves Alcohol, Table Service",https://www.tripadvisor.com/Restaurant_Review-g293962-d19338085-Reviews-The_Lagoon-Colombo_Western_Province.html,0,0,0,0,0,0,0,0,0,0,0,0,0,0,1,1,0,0,0,1,0,0,0,0,0,0,0,0,0,0,0,0,0,0,0,0,0,0,0,0,0,0,0,0,0,1,0,0,1,0,0,0,0,0,0,0,0,0,0,0,0,0,0,0,0,0,0,0,0,1,0,0,0,0,0,0,0,1,0,0,0,0,0,0,0,0,0,0,0,0,0,0,1,0,0,0,0,0,0,0,0,0,1,0,1,0,0,0,0,0,0,1,0,0,1,Medium,0,1,0,2
Dao Krua Thai,"618 Colombo - Galle Main Rd, Colombo 00300 Sri Lanka","Colombo - Galle Main Rd, Colombo 00300 ","[' 1000 ', '  20 000']","Thai, Asian","Vegetarian Friendly, Vegan Options","Lunch, Dinner","Seating, Table Service, Takeout",https://www.tripadvisor.com/Restaurant_Review-g293962-d12949347-Reviews-Dao_Krua_Thai-Colombo_Western_Province.html,0,0,0,0,0,0,0,0,0,0,0,0,0,0,0,0,0,0,0,0,0,0,0,0,0,0,0,1,0,0,0,0,0,0,0,0,0,0,0,0,0,0,0,0,0,0,0,0,1,0,0,0,0,0,0,0,0,0,0,0,0,0,0,0,0,0,0,0,0,0,0,0,0,0,0,0,0,1,1,0,0,0,0,0,0,0,0,0,0,0,0,0,0,0,0,0,0,0,0,0,0,0,1,0,1,0,0,1,0,0,0,1,0,0,1,Medium,0,1,0,2
Cafe Japan,"No. 25 Borella Cross Road, Colombo 00800 Sri Lanka","Borella Cross Road, Colombo 00800 ","[' 1000 ', '  20 000']","Japanese, Asian, Sushi","Vegetarian Friendly, Vegan Options","Lunch, Dinner","Reservations, Seating, Table Service",https://www.tripadvisor.com/Restaurant_Review-g293962-d3334515-Reviews-Cafe_Japan-Colombo_Western_Province.html,0,0,0,0,0,0,0,0,0,0,0,0,0,0,0,0,0,0,0,0,0,0,0,0,0,0,0,0,0,0,0,0,0,0,0,0,0,0,0,0,0,0,0,0,1,0,0,0,1,0,0,0,0,0,0,0,0,0,1,0,0,0,0,0,0,0,0,0,0,0,0,0,0,0,0,0,0,1,0,0,0,0,0,0,0,0,0,0,0,0,0,0,1,0,0,0,0,0,0,0,0,0,1,0,1,0,0,1,0,0,0,1,0,0,1,Medium,0,1,0,2
Ask For Fern,"32B Sir Mohamed Macan Marker Mawatha The entrance is through The Little Flower Shop, Colombo 00300 Sri Lanka","Ask For Fern, Colombo,00300","[' 10 ', '  30']",Asian,Vegetarian Friendly,"Dinner, Late Night, Drinks","Reservations, Seating, Serves Alcohol, Accepts Credit Cards, Table Service, Street Parking, Free off-street parking",https://www.tripadvisor.com/Restaurant_Review-g293962-d14784597-Reviews-Ask_For_Fern-Colombo_Western_Province.html,0,0,0,0,0,0,0,0,0,0,0,0,0,0,0,0,0,0,0,0,0,0,0,0,0,0,0,0,0,0,0,0,0,0,0,0,0,0,0,0,0,0,0,0,0,0,0,0,1,0,0,0,0,0,0,0,0,0,0,0,0,0,0,0,0,0,0,0,0,1,0,1,0,0,0,0,0,1,0,0,0,0,0,0,1,0,0,0,0,0,0,0,1,0,0,0,0,1,0,0,0,0,1,0,1,0,0,0,0,1,1,0,0,0,1,Low,1,0,0,2
Fire and Ice Pizzeria,"4 9a Glen Aber Place, Bambalapitiya, Colombo, Colombo 00300 Sri Lanka","Glen Aber Place, Bambalapitiya, Colombo, Colombo 00300","[' 1,000 ', '  2,000']","Italian, Pizza, European","Vegetarian Friendly, Vegan Options","Lunch, Dinner, Late Night","Takeout, Reservations, Seating, Outdoor Seating, Street Parking, Accepts Credit Cards, Table Service",https://www.tripadvisor.com/Restaurant_Review-g293962-d15360371-Reviews-Fire_and_Ice_Pizzeria-Colombo_Western_Province.html,0,0,0,0,0,0,0,0,1,0,0,0,0,0,0,0,0,0,0,0,0,0,0,0,1,0,0,0,0,0,0,0,0,0,0,0,0,0,0,0,0,0,0,0,0,0,0,0,0,0,0,0,0,0,0,0,0,0,0,0,0,0,0,0,1,0,0,0,0,0,0,1,0,0,0,0,0,1,1,0,0,0,0,0,0,0,0,0,0,0,0,0,1,0,0,0,0,1,0,0,1,0,1,0,1,0,0,1,0,0,1,1,0,0,1,Low,1,0,0,2
PappaRich,"33 Park Street Parkland Building, Colombo 00200 Sri Lanka","Park Street Parkland Building, Colombo 00200","[' 550 ', '  1,600']","Asian, Malaysian","Vegetarian Friendly, Vegan Options","Lunch, Dinner","Takeout, Reservations, Seating, Table Service",https://www.tripadvisor.com/Restaurant_Review-g293962-d16843695-Reviews-PappaRich-Colombo_Western_Province.html,0,0,0,0,0,0,0,0,0,0,0,0,0,0,0,0,0,0,0,0,0,0,0,0,0,0,0,0,0,0,0,0,0,0,0,0,0,0,0,0,0,0,0,0,0,0,0,1,1,0,0,0,0,0,0,0,0,0,0,0,0,0,0,0,0,0,0,0,0,0,0,0,0,0,0,0,0,1,1,0,0,0,0,0,0,0,0,0,0,0,0,0,1,0,0,0,0,0,0,0,0,0,1,0,1,0,0,1,0,0,0,1,0,0,1,Low,1,0,0,2
Kiku Colombo,"32 A1, Dickmans Rd, Colombo 00500 Sri Lanka","Dickmans Rd, Colombo 00500 ","[' 950 ', '  1,500']","Japanese, European, Fusion, Cafe","Vegetarian Friendly, Vegan Options","Lunch, Breakfast, Dinner","Seating, Accepts Credit Cards, Table Service",https://www.tripadvisor.com/Restaurant_Review-g293962-d15656473-Reviews-Kiku_Colombo-Colombo_Western_Province.html,0,0,0,0,0,0,0,0,0,0,0,0,0,0,0,0,0,0,0,0,0,1,0,0,0,0,0,0,0,0,0,0,0,0,0,0,0,0,0,0,1,0,0,0,0,0,0,0,0,0,0,0,0,0,0,0,0,0,1,0,0,0,0,0,1,0,0,0,0,0,0,1,0,0,0,0,0,1,0,0,0,0,0,0,0,0,0,0,0,0,0,0,0,0,0,0,0,0,0,0,0,0,1,0,1,0,0,1,0,0,0,1,1,0,1,Low,1,0,0,2
One Up all Day Breakfast & Coffee,"330 Galle Road, Colombo 00400 Sri Lanka","Galle Road, Colombo 00400 ","[' 1000 ', '  20 000']",Cafe,"Vegetarian Friendly, Gluten Free Options, Vegan Options","Breakfast, Lunch, Brunch","Outdoor Seating, Seating, Table Service",https://www.tripadvisor.com/Restaurant_Review-g293962-d11773719-Reviews-One_Up_all_Day_Breakfast_Coffee-Colombo_Western_Province.html,0,0,0,0,0,0,0,0,0,0,0,0,0,0,0,0,0,0,0,0,0,1,0,0,0,0,0,0,0,0,0,0,0,0,0,0,0,0,0,0,0,0,0,0,0,0,0,0,0,0,0,0,0,0,0,0,0,0,0,0,0,0,0,0,0,0,0,0,0,0,0,0,0,0,0,0,0,1,0,0,0,0,0,0,0,0,0,0,0,0,0,0,0,0,0,0,0,0,0,0,1,0,1,0,1,0,0,1,1,0,0,1,1,1,0,Medium,0,1,0,2
Belmio Pizza,"544 Madiwela Rd, Thalawathugoda, Colombo Sri Lanka","Madiwela Rd, Thalawathugoda, Colombo ","[' 700 ', '  1,600']","Italian, Pizza","Vegetarian Friendly, Vegan Options",Dinner,"Delivery, Takeout, Seating, Table Service",https://www.tripadvisor.com/Restaurant_Review-g293962-d10265422-Reviews-Belmio_Pizza-Colombo_Western_Province.html,0,0,0,0,0,0,0,0,1,0,0,0,0,0,0,0,0,0,0,0,0,0,0,0,1,0,0,0,0,0,0,0,0,0,0,0,0,0,0,0,0,0,0,0,0,0,0,0,0,0,0,0,0,0,0,0,0,0,0,0,0,0,0,0,0,0,0,0,0,0,0,0,0,0,0,0,0,1,1,0,0,0,0,0,0,0,0,1,0,0,0,0,0,0,0,0,0,0,0,0,0,0,1,0,1,0,0,1,0,0,0,0,0,0,1,Low,1,0,0,2
Min Han,"14 Deanston Place, Colombo Sri Lanka","Deanston Place, Colombo","[' 1000 ', '  40 000']","Chinese, Asian","Vegetarian Friendly, Vegan Options, Gluten Free Options","Lunch, Dinner","Takeout, Reservations, Seating, Table Service",https://www.tripadvisor.com/Restaurant_Review-g293962-d3209307-Reviews-Min_Han-Colombo_Western_Province.html,0,0,0,0,0,0,0,0,0,0,0,0,0,0,0,0,0,0,0,0,0,0,0,0,0,0,0,0,0,0,0,0,0,0,0,0,0,0,0,0,0,0,0,0,0,0,0,0,1,0,0,0,0,0,0,0,0,0,0,0,0,0,0,1,0,0,0,0,0,0,0,0,0,0,0,0,0,1,1,0,0,0,0,0,0,0,0,0,0,0,0,0,1,0,0,0,0,0,0,0,0,0,1,0,1,0,0,1,1,0,0,1,0,0,1,Medium,0,1,0,2
Blue Field Tea Center,"# 54 Haig Road, Colombo 00400 Sri Lanka","Haig Road, Colombo 00400 ","[' 1000 ', '  20 000']",Cafe,Vegetarian Friendly,"Lunch, Dinner, Drinks","Takeout, Reservations, Seating, Table Service",https://www.tripadvisor.com/Restaurant_Review-g293962-d12404554-Reviews-Blue_Field_Tea_Center-Colombo_Western_Province.html,0,0,0,0,0,0,0,0,0,0,0,0,0,0,0,0,0,0,0,0,0,1,0,0,0,0,0,0,0,0,0,0,0,0,0,0,0,0,0,0,0,0,0,0,0,0,0,0,0,0,0,0,0,0,0,0,0,0,0,0,0,0,0,0,0,0,0,0,0,0,0,0,0,0,0,0,0,1,1,0,0,0,0,0,0,0,0,0,0,0,0,0,1,0,0,0,0,0,0,0,0,0,1,0,1,0,0,0,0,1,0,1,0,0,1,Medium,0,1,0,2
Arpico Supercentre,"Hyde Park Corner, Colombo Sri Lanka","Hyde Park Corner, Colombo","[' 500 ', '  1,400']","Sri Lankan, Barbecue, Asian","Vegetarian Friendly, Vegan Options","Lunch, Dinner, Drinks","Takeout, Wheelchair Accessible",https://www.tripadvisor.com/Restaurant_Review-g293962-d10198038-Reviews-Arpico_Supercentre-Colombo_Western_Province.html,0,0,0,0,0,0,0,0,0,0,0,0,1,0,0,0,0,0,0,0,0,0,1,0,0,0,0,0,0,0,0,0,0,0,0,0,0,0,0,0,0,0,0,0,0,1,0,0,1,0,0,0,0,0,0,0,0,0,0,0,0,0,0,0,0,0,0,0,0,0,0,0,0,0,0,0,0,0,1,1,0,0,0,0,0,0,0,0,0,0,0,0,0,0,0,0,0,0,0,0,0,0,0,0,1,0,0,1,0,1,0,1,0,0,1,Low,1,0,0,2
Health House,"2B Reid Avenue, Race Course, Colombo 00700 Sri Lanka","Reid Avenue, Race Course, Colombo 00700","[' 8 ', '  300']","Healthy, Sri Lankan","Vegetarian Friendly, Vegan Options","Breakfast, Lunch, Dinner, Brunch, Late Night, Drinks","Takeout, Seating, Accepts Credit Cards, Table Service, Delivery, Parking Available",https://www.tripadvisor.com/Restaurant_Review-g293962-d15528873-Reviews-Health_House-Colombo_Western_Province.html,0,0,0,0,0,0,0,0,0,0,0,0,0,0,0,0,0,0,0,0,0,0,0,0,0,0,0,0,0,0,0,0,0,0,0,0,0,0,0,0,0,0,0,0,0,1,0,0,0,0,0,0,1,0,0,0,0,0,0,0,0,0,0,0,0,0,0,0,0,0,0,1,0,0,0,0,0,1,1,0,0,0,0,0,0,0,0,1,0,0,0,0,0,0,0,0,0,0,0,1,0,0,1,0,1,0,0,1,0,1,1,1,1,1,1,Low,1,0,0,2
Street Burger,"34 Ramya Road, Colombo 00400 Sri Lanka","Ramya Road, Colombo 00400","[' 1000 ', '  40 000']","Fast Food, American","Vegetarian Friendly, Vegan Options, Gluten Free Options","Lunch, Dinner, Late Night, Drinks","Delivery, Takeout, Accepts Credit Cards",https://www.tripadvisor.com/Restaurant_Review-g293962-d12682789-Reviews-Street_Burger-Colombo_Western_Province.html,0,0,0,0,0,0,0,0,0,0,0,0,0,0,0,0,0,0,0,0,0,0,0,0,0,0,0,0,0,0,0,0,0,0,0,0,0,0,0,0,0,0,0,0,0,0,0,0,0,0,0,0,0,0,0,0,0,0,0,0,1,0,0,0,0,1,0,0,0,0,0,1,0,0,0,0,0,0,1,0,0,0,0,0,0,0,0,1,0,0,0,0,0,0,0,0,0,0,0,0,0,0,0,0,1,0,0,1,1,1,1,1,0,0,1,Medium,0,1,0,2
Yaal,"Marine Drive Wellawatta, Colombo Sri Lanka","Marine Drive Wellawatta, Colombo ","[' 400 ', '  3,000']","Asian, Sri Lankan","Vegetarian Friendly, Vegan Options","Lunch, Dinner","Takeout, Seating, Television, Table Service",https://www.tripadvisor.com/Restaurant_Review-g293962-d4564394-Reviews-Yaal-Colombo_Western_Province.html,0,0,0,0,0,0,0,0,0,0,0,0,0,0,0,0,0,0,0,0,0,0,0,0,0,0,0,0,0,0,0,0,0,0,0,0,0,0,0,0,0,0,0,0,0,1,0,0,1,0,0,0,0,0,0,0,0,0,0,0,0,0,0,0,0,0,0,0,0,0,0,0,0,0,0,0,0,1,1,0,0,0,0,0,0,0,0,0,0,1,0,0,0,0,0,0,0,0,0,0,0,0,1,0,1,0,0,1,0,0,0,1,0,0,1,Low,1,0,0,2
Elevate Restaurant & Bar,"02 278/4 Union Place Colombo 29th floor, Access South Tower, Colombo 00200 Sri Lanka","Union Place Colombo 29th floor, Access South Tower, Colombo 00200","[' 500 ', '  1,400']","Sri Lankan, Chinese, Bar, International, Asian, Thai, Pub","Vegetarian Friendly, Vegan Options, Gluten Free Options","Lunch, Dinner, Drinks","Reservations, Seating, Serves Alcohol, Table Service",https://www.tripadvisor.com/Restaurant_Review-g293962-d15275309-Reviews-Elevate_Restaurant_Bar-Colombo_Western_Province.html,0,0,0,0,0,0,0,0,0,0,0,0,1,0,0,0,0,0,0,0,0,0,0,0,0,0,0,1,1,0,0,0,0,0,0,0,0,0,1,0,0,0,0,0,0,1,0,0,1,0,0,0,0,0,0,0,0,0,0,0,0,0,0,1,0,0,0,0,0,1,0,0,0,0,0,0,0,1,0,0,0,0,0,0,0,0,0,0,0,0,0,0,1,0,0,0,0,0,0,0,0,0,1,0,1,0,0,1,1,1,0,1,0,0,1,Low,1,0,0,2
Cafe Nuga,"7 69a, Green Path, Colombo, Colombo 00700 Sri Lanka"," Green Path, Colombo, Colombo 00700","[' 500 ', '  1,580']","Cafe, Healthy, Fusion, Sri Lankan","Vegetarian Friendly, Vegan Options","Breakfast, Lunch, Dinner, Brunch, Late Night, Drinks","Takeout, Reservations, Seating, Parking Available, Table Service",https://www.tripadvisor.com/Restaurant_Review-g293962-d14031438-Reviews-Cafe_Nuga-Colombo_Western_Province.html,0,0,0,0,0,0,0,0,0,0,0,0,0,0,0,0,0,0,0,0,0,1,0,0,0,0,0,0,0,0,0,0,0,0,0,0,0,0,0,0,1,0,0,0,0,1,0,0,0,0,0,0,1,0,0,0,0,0,0,0,0,0,0,0,0,0,0,0,0,0,0,0,0,0,0,0,0,1,1,0,0,0,0,0,0,0,0,0,0,0,0,0,1,0,0,0,0,0,0,1,0,0,1,0,1,0,0,1,0,1,1,1,1,1,1,Low,1,0,0,2
The Pizza Bakery - Bar & Eatery,"L6, One Galle Face Mall, 1A, Centre Road, Galle Face L6-04, One Galle Face Mall, Colombo 00200 Sri Lanka","One Galle Face Mall, Colombo 00200 ","[' 1,500 ', '  3,000']","Italian, Pizza, Bar, Beer restaurants","Vegetarian Friendly, Vegan Options","Dinner, Lunch, Late Night","Takeout, Reservations, Seating, Parking Available, Table Service",https://www.tripadvisor.com/Restaurant_Review-g293962-d19622992-Reviews-The_Pizza_Bakery_Bar_Eatery-Colombo_Western_Province.html,0,0,0,0,0,0,0,0,1,0,0,0,1,0,0,0,0,0,0,0,0,0,0,0,1,0,0,0,0,0,0,0,0,0,0,0,0,0,0,0,0,0,0,0,0,0,0,0,0,0,0,0,0,0,0,0,0,0,0,0,0,1,0,0,0,0,0,0,0,0,0,0,0,0,0,0,0,1,1,0,0,0,0,0,0,0,0,0,0,0,0,0,1,0,0,0,0,0,0,1,0,0,1,0,1,0,0,1,0,0,1,1,0,0,1,Low,1,0,0,2
Kami Maki,"26, De Vos avenue Colombo 04, Colombo Sri Lanka","De Vos avenue Colombo 04, Colombo","[' 396 ', '  3,956']","Fusion, Japanese, Sushi, Asian","Vegetarian Friendly, Vegan Options","Breakfast, Lunch, Dinner","Takeout, Reservations, Seating, Parking Available, Table Service",https://www.tripadvisor.com/Restaurant_Review-g293962-d6216220-Reviews-Kami_Maki-Colombo_Western_Province.html,0,0,0,0,0,0,0,0,0,0,0,0,0,0,0,0,0,0,0,0,0,0,0,0,0,0,0,0,0,0,0,0,0,0,0,0,0,0,0,0,1,0,0,0,1,0,0,0,1,0,0,0,0,0,0,0,0,0,1,0,0,0,0,0,0,0,0,0,0,0,0,0,0,0,0,0,0,1,1,0,0,0,0,0,0,0,0,0,0,0,0,0,1,0,0,0,0,0,0,1,0,0,1,0,1,0,0,1,0,0,0,1,1,0,1,Low,1,0,0,2
Sri Vihar,"Havelock Rd Havelock Town, Colombo Sri Lanka","Havelock Rd Havelock Town, Colombo ","[' 500 ', '  40 000']","Indian, Asian","Vegetarian Friendly, Vegan Options","Breakfast, Dinner, Lunch","Seating, Table Service",https://www.tripadvisor.com/Restaurant_Review-g293962-d1133610-Reviews-Sri_Vihar-Colombo_Western_Province.html,0,0,0,0,0,0,0,0,0,0,0,0,0,0,0,0,0,0,0,0,0,0,0,0,0,0,0,0,0,0,0,0,0,0,0,0,0,0,0,0,0,0,0,0,0,0,0,0,1,0,0,0,0,1,0,0,0,0,0,0,0,0,0,0,0,0,0,0,0,0,0,0,0,0,0,0,0,1,0,0,0,0,0,0,0,0,0,0,0,0,0,0,0,0,0,0,0,0,0,0,0,0,1,0,1,0,0,1,0,0,0,1,1,0,1,Medium,0,1,0,2
Mama Louies Sooriya Village,"49 Skelton Road Sooriya Village, Colombo 00500 Sri Lanka","Skelton Road Sooriya Village, Colombo 00500","[' 1,200 ', '  2,500']","Italian, Pizza, Central-Italian","Vegetarian Friendly, Vegan Options, Gluten Free Options","Dinner, Lunch","Seating, Table Service",https://www.tripadvisor.com/Restaurant_Review-g293962-d17838921-Reviews-Mama_Louies_Sooriya_Village-Colombo_Western_Province.html,0,0,0,0,0,1,0,0,1,0,0,0,0,0,0,0,0,0,0,0,0,0,0,0,1,0,0,0,0,0,0,0,0,0,0,0,0,0,0,0,0,0,0,0,0,0,0,0,0,0,0,0,0,0,0,0,0,0,0,0,0,0,0,0,0,0,0,0,0,0,0,0,0,0,0,0,0,1,0,0,0,0,0,0,0,0,0,0,0,0,0,0,0,0,0,0,0,0,0,0,0,0,1,0,1,0,0,1,1,0,0,1,0,0,1,Low,1,0,0,2
The Chaat Kade,"78C W.A Silva Mawatha, Colombo 00600 Sri Lanka","W.A Silva Mawatha, Colombo 00600 ","[' 200 ', '  500']","Indian, Street Food, Fast Food, Asian","Vegetarian Friendly, Vegan Options","Lunch, Dinner, Breakfast","Seating, Table Service",https://www.tripadvisor.com/Restaurant_Review-g293962-d12065915-Reviews-The_Chaat_Kade-Colombo_Western_Province.html,0,0,0,0,0,0,0,0,0,0,0,0,0,0,0,0,0,0,0,0,0,0,0,0,0,0,0,0,0,0,0,0,0,0,1,0,0,0,0,0,0,0,0,0,0,0,0,0,1,0,0,0,0,1,0,0,0,0,0,0,1,0,0,0,0,0,0,0,0,0,0,0,0,0,0,0,0,1,0,0,0,0,0,0,0,0,0,0,0,0,0,0,0,0,0,0,0,0,0,0,0,0,1,0,1,0,0,1,0,0,0,1,1,0,1,Low,1,0,0,2
